{
  "schema_version": "1.0.0",
  "timestamp": "2026-09-21T23:37:38.583748+00:00",
  "environment_telemetry": {
    "os": "Linux",
    "platform_release": "6.12.107+deb13-amd64",
    "python_version": "3.13.5",
    "cpu_count": 8,
    "memory_total_gb": 8.65,
    "cuda_opencl_available": true,
    "gpu_device_name": "GPU 0: NVIDIA GeForce GTX 750 Ti (UUID: GPU-748a0ca0-8645-103c-6f4d-18626e46537a)"
  },
  "engine_benchmarks": [
    {
      "engine_id": "eng_sensory_audio",
      "engine_name": "Sensory Audio & Beat-Grid Sync",
      "category": "audio",
      "iterations": 5,
      "mean_latency_ms": 5.197,
      "min_latency_ms": 4.864,
      "max_latency_ms": 5.463,
      "p95_latency_ms": 5.463,
      "throughput_ops_sec": 192.4,
      "memory_delta_mb": 0.0696,
      "status": "OPTIMAL"
    },
    {
      "engine_id": "eng_storyboard_narrative",
      "engine_name": "Storyboard & Narrative Flow",
      "category": "storyboard",
      "iterations": 5,
      "mean_latency_ms": 0.047,
      "min_latency_ms": 0.031,
      "max_latency_ms": 0.099,
      "p95_latency_ms": 0.099,
      "throughput_ops_sec": 21108.6,
      "memory_delta_mb": 0.0012,
      "status": "OPTIMAL"
    },
    {
      "engine_id": "eng_color_cdl",
      "engine_name": "ACEScc / CDL Color Grading Engine",
      "category": "color",
      "iterations": 5,
      "mean_latency_ms": 46.0,
      "min_latency_ms": 43.683,
      "max_latency_ms": 51.098,
      "p95_latency_ms": 51.098,
      "throughput_ops_sec": 21.7,
      "memory_delta_mb": 1.3645,
      "status": "OPTIMAL"
    },
    {
      "engine_id": "eng_fairlight_audio",
      "engine_name": "Fairlight EBU R128 Loudness Engine",
      "category": "fairlight",
      "iterations": 5,
      "mean_latency_ms": 19.468,
      "min_latency_ms": 18.612,
      "max_latency_ms": 21.364,
      "p95_latency_ms": 21.364,
      "throughput_ops_sec": 51.4,
      "memory_delta_mb": 0.6208,
      "status": "OPTIMAL"
    },
    {
      "engine_id": "eng_remotion_compositor",
      "engine_name": "Remotion / Overlay Graphic Compositor",
      "category": "remotion",
      "iterations": 5,
      "mean_latency_ms": 0.018,
      "min_latency_ms": 0.007,
      "max_latency_ms": 0.043,
      "p95_latency_ms": 0.043,
      "throughput_ops_sec": 55381.4,
      "memory_delta_mb": 0.0003,
      "status": "OPTIMAL"
    },
    {
      "engine_id": "eng_qc_auditor",
      "engine_name": "Quality Control & Certification Auditor",
      "category": "qc",
      "iterations": 5,
      "mean_latency_ms": 0.006,
      "min_latency_ms": 0.004,
      "max_latency_ms": 0.012,
      "p95_latency_ms": 0.012,
      "throughput_ops_sec": 170532.1,
      "memory_delta_mb": 0.0006,
      "status": "OPTIMAL"
    },
    {
      "engine_id": "eng_delivery_geometry",
      "engine_name": "Multi-Format Delivery Geometry Engine",
      "category": "delivery",
      "iterations": 5,
      "mean_latency_ms": 0.007,
      "min_latency_ms": 0.005,
      "max_latency_ms": 0.014,
      "p95_latency_ms": 0.014,
      "throughput_ops_sec": 135965.6,
      "memory_delta_mb": 0.0003,
      "status": "OPTIMAL"
    },
    {
      "engine_id": "eng_meta_skill_ast",
      "engine_name": "Meta-Learning Skill Synthesizer (AST Engine)",
      "category": "meta",
      "iterations": 5,
      "mean_latency_ms": 0.29,
      "min_latency_ms": 0.246,
      "max_latency_ms": 0.389,
      "p95_latency_ms": 0.389,
      "throughput_ops_sec": 3451.0,
      "memory_delta_mb": 0.0383,
      "status": "OPTIMAL"
    }
  ],
  "aggregate_metrics": {
    "total_benchmark_time_ms": 355.84,
    "pipeline_estimated_total_latency_sec": 0.071,
    "engines_tested": 8,
    "engines_passed": 8,
    "fastest_engine": "Quality Control & Certification Auditor",
    "slowest_engine": "ACEScc / CDL Color Grading Engine"
  },
  "performance_rating": "EXCELLENT",
  "production_readiness": {
    "status": "PRODUCTION_READY",
    "ready_for_release": true,
    "certified_by": "ADCRA Automated Benchmarking & Quality Assurance Authority",
    "release_candidate": "v1.0.0-gold",
    "notes": "Todos los motores cumplen con los SLAs de latencia para producción comercial."
  }
}